{
  "schema": "automatic-handoff-evidence/v1",
  "workItemId": "WI-2026-09-16-regression-and-docs",
  "assignmentId": "AS-53428fde-1de0-48eb-a045-37148a4f25de",
  "phase": "review",
  "role": "independent-qa",
  "designRevision": 1,
  "repairCycle": 0,
  "assignmentDigest": "01bb25e8e455b68389ee80f5076af4c3d537abb1cd3f38f5354249a8a06c7fa7",
  "handoffDigest": "7fcf1b5fdee68f79595f90d297d1d1357eca3d0976e8fda18cacc4c8f4fcf035",
  "persistedAt": "2026-09-16T12:09:25.940Z",
  "handoff": {
    "schema": "specialist-handoff/v1",
    "status": "completed",
    "verdict": "pass",
    "judgment": "REQ-001~007 · TC-001~007 모두 충족. 회귀 7파일 10테스트 PASS 2.8초, 단위 231 PASS, lint 0, doctor fail 0, 버전 7면 4.0.0, 문서 grep 전부 기대대로.",
    "decisions": [
      "TC-002 는 v2-commands 단위 3건으로 판정",
      "commit 별칭 부정 케이스 단위로 확인",
      "F 는 helper 미사용이 설계와 일치"
    ],
    "behavior": {
      "inputs": [
        "npm run regression",
        "npm test · lint · doctor",
        "Design·문서 8종 grep"
      ],
      "outputs": [
        "7파일 PASS 2797ms",
        "commands TC-002~004 PASS",
        "버전 7면 4.0.0 일치"
      ],
      "errors": [
        "validate 명령 scope 밖",
        "임시 repo 직접 실행 차단"
      ]
    },
    "evidence": [
      "tests/regression 7파일 · 머리말 장면/검증/렌더러 · A~E+commands helpers import, F 미사용 · 총 2797ms",
      "tests/v2-commands.test.js:310-363 TC-002(.gitignore 커밋·.vais 미포함·pre-commit 실패 reason) TC-003 TC-004 PASS",
      "CLAUDE.md:5,72-73,96 · README.md:2,16,63 · ONBOARDING.md:18-23 · design.md:140-197 · roadmap.md:25-26 · CHANGELOG.md:3"
    ],
    "affectedRequirements": [
      "REQ-001",
      "REQ-002",
      "REQ-003",
      "REQ-004",
      "REQ-005",
      "REQ-006",
      "REQ-007"
    ],
    "risks": [
      "실패 문구 커밋되지 않았다≠문서 커밋 안 됨",
      "추적 중이던 .vais 는 삭제로 커밋",
      "doctor plugin-cache warn 1"
    ],
    "unverified": [
      "plugin-validator 직접 실행",
      "QA 자체 임시 repo 프로브",
      "commit 확인 hook 실경로"
    ],
    "recommendedChecks": [
      "plugin-validator",
      "test",
      "lint"
    ]
  }
}
