{
  "schema": "automatic-handoff-evidence/v1",
  "workItemId": "WI-2026-09-29-unattended-chain",
  "assignmentId": "AS-20b0ad95-16ea-49ab-ae46-80b98cb30313",
  "phase": "review",
  "role": "independent-qa",
  "designRevision": 1,
  "repairCycle": 3,
  "assignmentDigest": "c901703b8154c67bfbf1b46b767443f428163ca58ac4312954a2892b78eb5340",
  "handoffDigest": "f521fc0ab0bfdb36486964dbf70e0ff5cbf3be7e6860afdd3a5417269731bde7",
  "persistedAt": "2026-09-29T10:12:06.912Z",
  "handoff": {
    "schema": "specialist-handoff/v1",
    "status": "completed",
    "verdict": "pass",
    "judgment": "PASS: repair-4 closes every prior bypass; no piece writes out-of-scope or runs code unauthorized; all checks green",
    "decisions": [
      "backslash/brace/quote word denied",
      "check -- and load flags blocked",
      "node --test only tests/ paths"
    ],
    "behavior": {
      "inputs": [
        "tr\\uncate, comm\\and",
        "eslint -f, npm -- -c",
        "node --test /home/e.js"
      ],
      "outputs": [
        "all denied by policy",
        "271 unit + 11 regression",
        "validate 0, doctor fail0"
      ],
      "errors": [
        "no unauth write/exec",
        "lint 0 warnings",
        "doctor warn2 preexist"
      ]
    },
    "evidence": [
      "scratchpad/p4.js: 60+ authorizeCommand cases, every write/exec bypass attempt denied",
      "node --test tests/*: 271 pass; npm run regression 11/11; npm run lint 0 warnings",
      "validate-plugin 0err/0warn; doctor fail0 warn2; version 4.4.0 on all manifests+badge"
    ],
    "affectedRequirements": [
      "REQ-001",
      "REQ-002",
      "REQ-003",
      "REQ-004",
      "REQ-005",
      "REQ-006"
    ],
    "risks": [
      "-o/-u blanket false pos",
      "auth scratchpad node runs",
      "git -c needs auth only"
    ],
    "unverified": [
      "TC-001 live hook (cache)",
      "guard blocks direct npm run",
      "stray trncate from rd3"
    ],
    "recommendedChecks": [
      "test",
      "lint",
      "plugin-validator",
      "secret-scan"
    ]
  }
}
